review_id,rating,review_text,review_date,helpful
dda39b93-6fba-4c13-8661-6303462c9c9b,5,Very cool app,11/23/2025 13:09,0
0863dbe3-4c13-40c7-a1c3-34b65ee90b90,5,this app is very good and very useful for the communication,11/24/2025 12:05,0
a59861f6-72ca-4c45-889f-60447b86edf9,5,what's up is good and helpful❤I will give for this app 5 star rating,11/23/2025 22:06,1
ec3b65c7-4abf-4c68-8466-623bb9596958,5,this app is very good it has it's own AI that really cool you can ask any questions on it and it give you the correct answer,11/24/2025 1:59,0
0d7929e9-96de-4337-a876-55f6c28954c6,2,my experience whatsap to my mom's,11/23/2025 13:13,0
2c6187f5-29f1-482b-b419-7388ba2e59ed,5,very good experience ... i have a request .. please also add .. profile viewers or profil picture viewers in whatsapp,11/23/2025 19:02,0
591cc098-c58a-411d-8c9b-9695419433cf,5,it's really amazing,11/22/2025 12:43,0
e9dca5f7-0f21-4a09-9f9f-c36019fbed92,5,it's amazing and communication with each other people 🥰😇,11/25/2025 13:12,0
6461377b-977d-451a-a9d4-efc813babc63,3,the new update has a dazzling sound on video calls,11/21/2025 21:31,0
AB45Mfgw-3h8K-DQ8o-U1F0-IvyiwSmRO7Mr,5,notion notion notion notion notion notion notion notion notion notion notion notion notion notion notion notion notion notion notion notion notion notion notion notion notion notion notion notion notion notion notion notion notion notion notion notion notion notion notion notion notion notion notion notion notion notion notion notion notion notion notion notion notion notion notion notion notion notion notion notion notion notion notion notion notion notion ,24/11/2025 12:18,0
DomG7r0T-fu03-GWky-cK5e-tu6mkloUsEsQ,4,CCCCCCCCCCCCCCCCCCCCCCCCCCCCCCCCCCCCCCCCCCCCCCCCCCCCCCCCCCCCCCCCCCCCCCCCCCCCCCCCCCCCCCCCCCC,26/11/2025 02:44,0
4ca88e4d-d7e9-43f8-b759-dcdcbc204c08,3,I love it so much 🥰🥰🥰,11/22/2025 2:58,0
cb584eb7-e47b-4fee-9e41-35475805a545,1,plz on that wp,11/24/2025 17:57,0
15be433c-f4ae-490a-ae48-5d2297f8a3a1,5,it enable someone to enlight like advance in any situation,11/25/2025 0:30,1
51bc6bf6-bfdb-4757-a7bb-0069d1afbb7a,3,easy back up process,11/24/2025 13:35,0
ab55a365-944e-40e5-8ae3-db7e3e692cde,1,Unable to download this app in my window 11 pro,11/25/2025 14:33,0
e637f247-06bb-471c-bfdb-134f6cadc86b,1,stupid app my number is not verifying from 3 to 4 days code is coming but not verifying very irritating,11/22/2025 6:15,1
8756feef-d3ec-4ef8-8161-35f216844bd2,5,Whatsapp is a Family of Social Media and Whatsapp is a Best services in the world,11/21/2025 21:20,0
d76439d6-c294-4100-9886-7d4b020a2c19,1,Y my popup is disabled I unable to receive msg notification until I open it please kindly fix it soon,11/24/2025 1:07,0
cQ8hx9ZJ-fFpt-3AoC-1Uez-DR8jzJvhQDbl,2,spirit extraordinary DNA venture potential collection accuse stage God forever coast conviction intelligence adjustment efficiency above prison medicine ghost science fish illegal attorney talk suicide ago dress running DNA agent educate sustain add trust practical reading publisher,26/11/2025 20:18,1
cjwKRhPb-76xN-pPKS-u3PL-rO9Dz0fkoAuM,4,afraid declare adviser involved pass gas double intense auto sophisticated union mad people spread be stay rose unlike register location front visual appear lock weight quick impression bury dream front muscle nevertheless corner missile different will identify contemporary unlike embrace since dog naturally anybody gas inquiry healthy tax furniture gain fate taste heat suddenly utility strategic cabin kiss blame tradition late assignment participant hearing time explode result tie coal mess white news tour breakfast tape case wait artist dog bury photo arrest plant lesson scenario female attract deputy approximately host it slight fabric proportion strip piano telescope additional occasion history,26/11/2025 01:08,1
36346858-a23a-4456-adf0-758362b896a2,4,Best Messenger Application... Easy To Use..... UseFull App,11/24/2025 16:15,0
37130181-ca76-4ea3-ae8f-4cac8e993419,1,It s not verifying my number,11/23/2025 18:33,0
ae467a66-f54e-44bd-bb92-6f3bb5d663b3,5,It is good to have it because I can chat with others,11/25/2025 13:13,3
lx1RshEr-G433-7fEI-AXwN-dZRn7cH5sab3,5,Italian Italian Italian Italian Italian Italian Italian Italian Italian Italian Italian Italian Italian Italian Italian Italian Italian Italian Italian Italian Italian Italian Italian Italian Italian ,21/11/2025 13:39,0
50bf05ed-1eac-42fe-9849-0c53651c2caf,1,Its been a terrible one. Try making it a non-data usage app,11/23/2025 21:10,0
d8ef4aad-b387-4c02-a7c3-23ad1a014f61,1,Not good aplication for chats,11/21/2025 23:19,0
76ebe0d6-337e-491a-8d37-33873e748cc4,5,I want my WhatsApp Privacy recover,11/22/2025 21:55,0
6a85b62f-68bc-4321-93c5-fe8b308d3635,4,am enjoying the app,11/25/2025 0:07,0
ba2d7b14-6c14-468f-b676-1b9cdc31f516,1,it was such a disgusting experience. I am totally upset 😞,11/21/2025 22:16,2
82ad9392-7661-435f-8cab-0257ff9ee945,5,A perfect app for messaging others...,11/23/2025 18:34,0
08a1e1aa-a7ed-4e15-bb9c-ed5bab1ba83e,5,Perfect,11/25/2025 18:47,0
e032ca0b-b8a6-498d-b402-933dcbb82da3,5,the best so far,11/24/2025 21:58,0
497c8a80-a7b5-41eb-b10a-d0b9533876d1,1,"Nah, i have changed my mind",11/23/2025 13:44,0
1ffc9b63-3acf-46b2-aa68-ca3abe39c204,1,"Cannot install it on my Huawei and I want WhatsApp to know even when I install it from the WhatsApp website, it still says it is unofficial. It even kicked me out in the middle of the night after normal usage for months. What is wrong with this developer? Someone who does not use it for no reason. Can this be sorted. Is this political or just really a privacy issue? Whatever it is you guys are loosing me as a user of two WhatsApp accounts. Going to report this to the highest authority.",11/25/2025 9:45,0
3b927b79-7f03-417e-b4d5-d48c1e37e967,1,My WhatsApp Number is banned last week and I tried to restore but I falled,11/24/2025 10:01,0
02850c8d-155a-4c53-af4e-1cc494fba6b7,5,I love it 😍😍,11/25/2025 10:54,0
e75aa054-74ef-4573-9914-269e418a08db,2,no longer be used due to spam,11/25/2025 13:29,0
3a2971db-8e1a-4132-9e03-ec8d8f2288f7,1,"Hey Dear whatsapp community Team Help , My account is banned Iam not able to run whatsapp Read All yours Terms and conditions. we will follow rules. I hope you will unban whatsapp as soon as possible . Thanks",11/22/2025 21:37,0
74d4b8fe-7725-4ea5-a37c-5564e1cfc035,4,I got a good experience with the privacy it offers,11/23/2025 14:28,0
55324729-df9a-4731-ac13-0decdb08735a,5,I can not loging to my acctount,11/25/2025 1:57,0
bd94bcae-37e6-400b-aab2-16e0fc7b0e80,5,Really good,11/25/2025 21:59,0
c0HHtZUI-iCQ3-Hqj1-nWQk-tPo5ErImcvfl,3,VVVVVVVVVVVVVVVVVVVVVVVVVVVVVVVVVVVVVVVVVVVVVVVVVVVV,22/11/2025 10:23,1
PEpwFLFh-YjRj-40GY-WSkx-3XqbDsoNDbIh,4,FFFFFFFFFFFFFFFFFFFFFFFFFFFFFFFFFFFFFFFFFFFFF,24/11/2025 17:10,0
aad4276d-f3f2-4ce5-b666-2757afd9f418,5,will try to call to anyone on WhatsApp it's showing connecting problem please fix this issue as soon as possible,11/24/2025 15:29,0
3bfb7a57-073e-4206-8ddc-69bd16d5fbc4,5,True App,11/23/2025 12:45,0
b79e0a5c-5865-4151-a724-36a72ea44d94,1,I can't get my fb code 🤬,11/22/2025 21:51,0
b876d3de-ffd8-4a2a-a44f-cff56511ae17,1,cool wrok,11/26/2025 21:29,0
337043ad-4ac4-4393-99ef-8d6100460db9,1,"Rubbish,Rubbish,Rubbish So dissapointed I downloaded it on my samsung A32 tha app keeps saying download the official app keeps on stopping so useless 😡😡",11/25/2025 18:45,0
ebbebda7-c4c6-41c0-a685-0e7d47ceb0d1,4,Why can't I open my whatsapp,11/24/2025 0:31,1
1db5ebb3-1a8a-48ea-bcb3-2310b5937ac4,5,"This app is very good, for tolk",11/25/2025 21:27,0
jvst77AW-G2TG-ER6C-OPp1-lPNurS3C0oi1,3,digital nine appearance after rich component top congressional tunnel authority insist question junior love flower location adviser apple musical route crisis document machine virus cry murder ourselves steel elementary specific regarding myth draw drag well motivation option unusual poet testimony federal capital forward file county tire excellent surprise meaning valuable flower ideal bedroom very weekly global description virtually function type itself locate movement apply sudden fast curriculum picture better heaven hungry respond general tight prompt visual depth red major radical fruit heel calculate literally against without grass load previous choose desire base formal prosecutor senator eat beside,24/11/2025 23:08,1
202df8e4-c995-4d07-97f4-62d874be2a1e,2,i can open my business WhatsApp with my number since yesterday 11 pm as we speak i dont have WhatsApp and im working using whaatsapp please assist it busy givee the same message to download i download still. give the same message want me to change number and i cany change my number i try to install still give me the same message try with share it no luck on my side please assist i need to have whaatsapp today morning please assist me to have my whaatsapp back im using it for business please assi,11/25/2025 8:49,0
GZRvvIAu-q7SN-dRJZ-9LP9-XvINNUNZHxTy,4,combination combination combination combination combination combination combination combination combination combination combination combination combination combination combination combination combination combination combination combination combination combination combination combination combination combination combination combination combination combination combination combination combination combination combination combination combination combination combination combination combination combination combination combination combination combination combination combination combination combination combination combination combination combination combination combination combination combination combination combination combination combination combination ,21/11/2025 12:30,0
3ddb8584-26ed-449c-a3a0-3bf87328419d,5,love this app activities everything is well ❤️,11/24/2025 0:41,0
6984d271-3bee-40a6-8acb-41fa453bd697,3,"My name is Ajay Pagare. I was notified that my account is banned from using WhatsApp. I have reviewed the Terms of Service and believe my activity complies with all guidelines. I have not engaged in spam, bulk messaging, or any prohibited behavior. ​Being unable to access my account is causing significant disruption. I kindly request a manual review of my account status and ask for the ban to be lifted. ​Sincerely, Ajay Pagare",11/26/2025 21:56,0
cfa878a8-a85f-43da-8acf-bf1bf485fbf6,1,I'm trying to verify my number on wtspbut not received verification code plz fix this problem,11/24/2025 23:40,0
0b4ec390-d49e-4b06-8e4e-0b30f47f283c,1,I can't download WhatsApp,11/25/2025 16:31,0
234c5459-3a60-4fa6-bd2a-a24bd909486f,5,Waiting,11/22/2025 4:21,1
e771d26c-83f3-4151-ad64-33d991190579,3,"The frequency of ""update"" of the app is annoying. The option of permission to add to a group should be returned.",11/22/2025 16:57,0
05541cc4-8bde-489e-85d9-8b410aa117a1,1,not even good I am trying to use this and it is continously saying u need official app,11/26/2025 21:20,0
90abd2d1-590d-456b-8696-2c2df95b998c,5,I would like to use whatsap,11/25/2025 16:09,0
a77199a2-9d63-4ca5-946d-669d0eefc13a,5,it's nice,11/24/2025 15:33,0
9913b0aa-1c37-482e-a1d0-b9f417dc81dd,1,"I'm Agree With You And I will Respect WhatsApp's All Terms or Policy But it was formonixofficial I'm Not Doing Anything Wrong On Whatsapp I'm Sharing Important And Useful Message Related To Education But Some People Are Wrongly Flags or Reported My Account So WhatsApp was Banned my account. My Humble Request To You Whatsapp Please, Unbanned my WhatsSApp It's My Official WhatsApp number So My Friends, Family, Clients Are Unable To Contact me It's Huge problem For me. I hope you will understand.",11/22/2025 19:50,0
e43aaef9-9350-4c1a-9052-8f30ff7fc2ba,5,I will rate It 5 stars because it is good for communicating and it's reliable and the reshare button is a game changer,11/23/2025 1:19,1
d45f8852-aa4d-4dfa-b452-f29a1e7a67b5,4,used to be perfect. but changes have been made to line change plus time you are speaking if you look elsewhere for info. not good changes. want old set up back. not so easy now.,11/25/2025 14:41,0
bdc6c9f3-4be5-4e5c-96dc-5c3aeef5d81b,1,Do something to remove the recommendation/ explore in whatsapp channels. irrelevant and inappropriate channels are being recommended. kindly add a option to disable chanels and keep the app user friendly.,11/21/2025 23:26,2
2f2cfb73-6418-458c-ba16-4cf0e5f91063,5,My account is not working. Rest is fine,11/22/2025 15:56,0
85f4148d-a37b-40e3-b8c2-95971e9dd5f6,2,I am facing technical glitches.,11/25/2025 2:43,0
be4e23e1-1623-47d5-8190-b15d15145642,1,why are they telling me to use the official WhatsApp to log in whiles I have downloaded the official WhatsApp here,11/24/2025 3:32,0
f4a23dee-5a9a-411a-ad45-80ac63653286,5,boss,11/21/2025 21:46,0
1d29108f-40a9-4cd4-8d12-1ad0d4878644,5,simply the best,11/23/2025 16:07,0
64e263a9-f86e-4cc4-8670-f7b994e7d383,5,Easy to use and secured,11/25/2025 22:04,0
f3d8c061-1822-4089-abac-0745465088c7,1,stupid app always getting spam when I chat 😭😭😭,11/25/2025 20:59,0
eaaed263-3773-49b2-a6fe-c9a9008cd362,2,"it has got some mic glitch in the recent updates, my mic doesn't record a thing in voice message and I have to force stop and then start it. Asof now audio messages aren't getting anything recorded.",11/25/2025 15:16,0
e05b3215-e921-4195-b68d-464c2e364998,5,good app,11/24/2025 0:40,0
2d329b7f-e545-4d94-b256-5deb4e5b9a4a,5,To download apps,11/26/2025 18:30,0
1a863499-e38e-480d-9ee6-164b2092aa07,5,please make sure the transcript chat in Italiano,11/25/2025 14:14,0
61aa05a0-9ed5-4a9a-987f-23524f0a580d,1,crashing,11/24/2025 21:49,0
04aa2946-67fb-41f9-bed1-e28c75a58f33,1,Whatsapp is not opening 😔,11/25/2025 17:12,0
5f8d6252-4cb5-423b-a209-71a57ef02810,5,Very graceful app,11/23/2025 15:09,0
c9ac1f01-c25b-4497-8978-9a6af4dc3301,5,very nice app and useful,11/26/2025 13:10,0
6c9b45ee-8d73-4543-8473-a04445090c53,5,whatappopen,11/22/2025 10:37,0
a026fc8d-7f47-4b5b-8dd7-f611fc01e62b,2,"I've been using this app for long without any issues, but recently, I started facing this issue of bluethick if someone sends messages to my account it will not notify me on my devices and it show to the person that I've read his message, I've updated it to latest version but still not fixed",11/24/2025 16:02,2
2BMnnQrs-jRus-1nOr-AnzS-dns6YEa0w6RN,1,lllllllllllllllllllllllllllllllllllll,25/11/2025 17:01,0
97768332-9b6b-4daa-88d7-081405ce99e1,5,welcome 🤗,11/24/2025 22:15,0
d223a789-5f09-4b50-8052-48b757a1bb26,5,WhatsApp restart,11/22/2025 15:00,0
9wf4gj1l-eUK3-VOhg-WZay-8hyx4UNaeUJ4,3,proud proud proud proud proud proud proud proud proud proud proud proud proud proud proud proud proud proud proud proud proud proud proud proud proud proud proud proud proud proud proud proud proud proud proud proud proud proud proud proud proud proud proud proud proud proud proud proud proud proud proud proud proud proud proud proud proud proud proud proud proud proud proud proud proud proud proud proud proud proud proud proud proud proud proud proud proud proud ,26/11/2025 01:53,1
8a220f73-88ac-403b-a42d-387f3864d50e,1,"I got banned for literally ""spamming"" by sending 4 short messages",11/22/2025 18:08,0
16f4f0a5-c7ef-4fa4-a902-4d06e90901d9,4,pretty good app bruh,11/24/2025 3:46,0
99588fff-7251-4173-beec-0cc9bf630db7,5,I love this app,11/22/2025 8:35,0
f0126d35-8c91-4931-b675-52edb83f12f1,1,This is the only way Yahoo will send me a verification code,11/22/2025 8:28,1
affd6a5c-a546-41fb-ac5d-f6658e8ac4b1,5,I am satisfied with this app,11/25/2025 19:11,1
14ebbd72-a54a-4ce0-bdce-6fbdf860fbfe,4,"Nice app for chatting with one another through messages, voices , statuses",11/24/2025 18:17,0
835ff90c-e969-49c3-956a-e3841bfbc1da,5,Nice one,11/24/2025 12:37,0
2e221757-0a4d-4c7c-ac59-f8ac3f3ca016,1,"good,great,reliable,awesome ,and above all, easy-going",11/24/2025 1:26,0
975f52f3-7333-445a-8d8f-a95fddb52701,5,is really good,11/22/2025 8:42,2
04368ec2-d7f7-4606-815a-906826130002,5,easy-to-use,11/26/2025 15:12,0
e73494c2-6bb0-46af-93bc-5ab2a9f7460c,5,good aap and very fantastic,11/22/2025 14:04,0
4781f0f1-e966-488a-8f37-ea0c33e1bc86,4,very nice app and good verk,11/22/2025 23:02,0
93ff98b6-b975-4c30-a336-8122d0adc1ff,5,very informative n easy,11/22/2025 0:21,1
0c73aab1-1db8-4967-9d2b-f241ae701e2b,5,I need whatsapp,11/24/2025 16:39,0
471c5cc0-bde3-46b7-98a6-739690ae111f,5,It's just they best app to chat and communicate with family and friends 🥰😍,11/25/2025 4:25,0
19fc7e87-e945-420b-a681-09b70518ab48,3,"increase messages groups limit 5, increase 3 limit tap to top, increase broadcast messages limit of 35 per month",11/23/2025 14:04,0
e25ddc07-73f2-427e-8814-c2284b0b5556,3,would highly appreciate if an option is enabled for hiding the updates tab.,11/25/2025 13:27,0
3ae4b8a6-67af-45e5-8414-7a330dcc9793,4,fast reliable and confidential best social communication app ever,11/25/2025 12:55,0
7edeeac4-6936-4af8-b834-0cd72ef68d65,5,enjoy with this app,11/23/2025 8:24,0
a5acc3db-fa55-43f5-80b2-566dd97b694d,4,"The past month or so, for some reason if I take a picture through the app and try to send it, it doesn't let me press the send button. It just doesn't do anything. If I use my phone camera to take a picture then send it on WhatsApp then it works fine. The app needs an update to fix this bug. Please fix this.",11/24/2025 23:16,8
iJrZdLXI-dnue-PAMV-pI9X-cXT08zHpS3aK,4,kkkkkkkkkkkkkkkkkkkkkkkkkkkkkkkkkkkkkkkkkkkkkkkkkkkkkkkkkkkkkkkkkkkkkk,22/11/2025 23:34,1
87cJhFYj-iQfK-N8f8-AXPL-jgrx9cJQzNly,4,SGjW2vb3bPyv1iTUVUUn5jbMl6jR9xLxxbX4UUkXeRfxrNGZfHaAJLMLgF5CmRgPwhRezJQovF,22/11/2025 22:07,0
52257fa8-3d4e-4870-bed1-940f15936089,5,It's Just a good app,11/22/2025 15:21,0
015eb4aa-812c-4b3a-8758-32ac2fc75553,3,Very good for my work,11/22/2025 5:31,0
0814e82c-22f4-418f-b3e7-9439a07081a4,3,The app is ok,11/22/2025 13:12,0
0b5500ee-ae8e-4835-8b92-da166266a918,5,I want to return to my WhatsApp,11/24/2025 2:54,0
d673ed9d-09fb-4843-aea0-9693960a92fc,5,good apps,11/22/2025 12:46,1
2874ad40-b2a3-4968-b326-698b8dd5e432,5,my WhatsApp is running sloww,11/23/2025 2:08,0
fcae2c9b-48b8-4d14-9b96-2e97bc0e5ff6,5,"WhatsApp is a great and professional app but I don't know why everything just changed"" they started spamming people account you people should work on your company thank 😍",11/23/2025 22:59,0
fc81f0d2-0826-43b2-ab04-f88f300e8619,1,worest app,11/25/2025 16:33,0
8ebd3c11-8898-4c94-b063-fa1911ab5110,5,"Two account backup not working ,Restore whatup not working, kindly do the needfull",11/26/2025 17:32,0
e0962f25-15a6-442f-bac3-7d687e64c63b,5,Please update my WhatsApp,11/24/2025 23:39,0
8edb1afb-507b-49a0-a4e6-8143eb49e055,1,there's no reshare button on my WhatsApp,11/25/2025 22:07,0
P7jYDYr6-NXuB-91G5-yWVH-Y7fmN7zMWtEz,3,serious TV expectation fast training test situation ourselves short husband layer plot hardly conduct butter you positive engine unable half picture narrow ultimately start besides resolution salt exchange anxiety west complete naturally historian transfer machine charge distinguish old season organize slightly juice fade sales employ card peer yield educate straight receive golf horizon lady latter imagination guest perfectly auto greatest motor create Spanish uniform year conflict comment religious,26/11/2025 21:28,1
c07850be-66fe-4a15-be81-a66c80b2a075,1,filled with glitchs,11/24/2025 11:04,0
zQVoezrJ-ptFL-qKoy-uXvr-v29HiuvOunqt,4,11111111111111111111111111111,22/11/2025 11:52,0
60c1fd03-59fd-4d0d-9256-0e3bac185209,2,it helps as for research,11/24/2025 22:57,0
3d947982-fab7-4d1c-b2f6-752cd447017c,5,please my WhatsApp keyboard give me older,11/25/2025 23:27,0
1644f64a-e93e-4c44-9d83-c8edd64a4067,1,screen share bd kro app se,11/26/2025 20:07,0
3f97f47b-dea8-4866-9c93-3166915e096f,5,I love the app it a good app,11/24/2025 0:33,0
26b969e0-f84c-406f-a987-7894884722a4,1,Can't I just use an email to log in? I changed my phone number and lost a lot. + Using my computer is a real pain without a smart phone for some reason. edit 2025: how do we disable the meta AI garbage?,11/24/2025 22:25,0
bfcdb1eb-f0af-404a-930e-6cdd6c4d2afd,5,best app for call and message,11/23/2025 11:44,0
bb94e56b-f65d-4af5-8364-29ec8abf0f1e,1,WhatsApp not opening buffering worst update,11/26/2025 7:45,0
bd966167-8fda-4b02-9593-3b5628c75d0d,1,what happened to the costom ringtones can u please put it back ASAP PLEASE I REALLY CAN'T LIVE WITH OUT IT I NEED MY COSTOM RINGTONES THANKS,11/25/2025 1:18,0
11b1a494-2255-4c2b-a5d9-cff34610ed67,5,good and user friendly,11/25/2025 9:04,0
7MjUBASs-H6vf-1nWR-iLAj-A5FYHCil8xmO,1,downtown qualify tree success lucky decline phase flame producer telescope traffic friendly product overlook off this steal estate challenge Congress,21/11/2025 17:19,0
66c1177e-5084-48f1-b09a-520fd404fc32,5,That's a great,11/26/2025 11:18,0
dRSbQjox-5sew-X5Jp-eJsp-K9i2DNXpuFtg,5,HHHHHHHHHHHHHHHHHHHH,23/11/2025 18:22,1
Ahgmak0F-XOfD-EqXY-jWMa-3JXQRHJc2OK2,4,Indian Indian Indian Indian Indian Indian Indian Indian Indian Indian Indian Indian Indian Indian Indian Indian Indian Indian Indian Indian Indian Indian Indian Indian Indian Indian Indian Indian Indian Indian Indian Indian Indian Indian Indian Indian Indian Indian Indian Indian Indian Indian Indian Indian Indian Indian Indian Indian Indian ,26/11/2025 05:04,0
d1bfb34d-5cca-4f7c-89da-f8e7d526292a,5,Thankyou very much now I am well now 👍👍,11/25/2025 6:38,0
795c25fa-9e9f-4142-838b-3a716230bd11,5,So interesting and courageous,11/25/2025 1:52,0
7be870f1-f7c5-48bb-bfb6-fa528fecfdc3,5,its cool and needs little data doesn't bring ads very nice app,11/22/2025 0:15,0
390f9610-1547-4506-9bbe-91315b5292d9,2,i love this app,11/26/2025 3:34,0
cxQSybpD-NzdG-T9yo-RMkz-fSYIMgV7ygND,2,white believe attack foreign unlikely produce year trouble pair custom scale efficiency ultimate opposite car differ easily look okay window briefly,24/11/2025 23:33,0
d0136a96-928e-4aef-a087-5b853c191ece,5,I think it is very good,11/23/2025 20:33,0
feacee78-658d-493a-ae93-bfafd8869dcd,1,my account got showing. no longer use of this account please help me with this,11/22/2025 18:24,1
a0f6c3c5-fdaa-44ff-90cc-c4b646fa2c54,5,"this app helps me to connect with many more people(friends,family) it helps me to be in touch with them whenever I want🥹❤️‍🩹❤️‍🩹",11/23/2025 18:59,1
aeab6fcb-be46-46c6-8b2b-07b256036748,4,Some songs are not there when you search for them I don't know why,11/22/2025 10:33,1
e4fed7c5-5a00-4b39-9f11-135142ffda41,2,having to upgrade every month is stressful,11/25/2025 16:59,0
71043c59-0ed0-4008-b7d4-c3d300954987,5,Very helpful,11/22/2025 17:10,0
9091edfd-b229-42d3-a639-cd7a455b5b84,4,This is good and great and wonderful and this is beautiful.,11/21/2025 19:58,0
25e99a4b-5f61-4b01-a17e-f9891ba61b17,1,verification code not received emergency for me please send me verification code,11/22/2025 10:29,0
2b0c3f62-f610-4c8c-b1b7-e0190662a2fe,4,Maybe whatsapp community should create a location filter for status. And let a user to be able to review a status update after uploading it.,11/23/2025 1:45,1
219a1f9d-a9e3-4a22-a103-5b9202b07fef,5,it's a good platform for connecting people and promoting businesses as well,11/25/2025 19:26,0
0d22837d-010f-465c-988b-0e823e21adcb,1,Third class messenger app 👎,11/21/2025 23:16,1
5fe4af4a-680c-41d2-8af5-c73e76ed43b4,5,right 👌🏻,11/23/2025 19:15,0
4551d96f-6bcd-488e-9139-ade9e7596247,1,"After update msgs r nt deliver on its time, if I send msgs now it will deliver after 3-5 hrs nt not sure of it also",11/24/2025 7:50,0
db652294-867c-444e-b3cd-109412382cfe,5,"I send you a hundred times and hundreds of resspect for you, you are a great software and program for installation and storage that I can even write to and call mom peace.",11/24/2025 18:13,0
55L6dXbB-ctoR-vytb-Tc4D-W6KYaJYl1k0o,5,N3nhoxC4OJnQHXoBGzM,24/11/2025 21:10,0
fec515e8-5e4f-4745-bb57-e5401a35f437,5,asalamo aliykum..sir mery paas Whatsapp messenger ha but ya open ni ho rha... two step verification code mang rha ha or wo mujy yaad ni haa abb Kia karon... please help me...,11/24/2025 15:06,0
7fd016a6-4041-4eb8-b19b-302e08219194,5,"To be fair, I did not like the recent update with the user's bio being like in a temporary display. I may be weird but I just love reading bios of myself and others. Should have just remain as it is. Or, make a ""never"" button so that I don't have to modify my bio every single day. Improve this issue and I will give you full rating. Thank you.",11/25/2025 16:44,9
39f60c22-6dbe-46a5-8bc4-9e873b80a5a4,5,please please please,11/26/2025 18:05,5
0ca3fcda-1a0f-4872-acb7-3576ba75e7eb,4,Quite easy I think!!,11/25/2025 15:57,0
1fb1e750-6f47-4c2c-9e92-87f0d297524c,5,I want to update my WhatsApp,11/22/2025 13:29,0
ac6c71fe-85f9-40bf-ae1c-8e61a625e7fa,5,THE APP COULD DO WITH SOME LOGO UPDATE,11/26/2025 16:25,0
779ad7f2-5c66-404d-91f6-980b19a75356,3,I have experience good life from deferent people,11/23/2025 9:18,0
92294376-7d49-42de-a512-f393097d3253,5,I use it on my phone and i have to say its the G. O. A. T definetly a go-to,11/24/2025 5:27,0
b1dec5c6-0354-4a90-8d05-e01243b06a24,5,"Please add an ""edit status"" feature.Also let's be able to write a longer status, and choose what we want as the app lock instead of just the phones lock.",11/24/2025 15:42,8696
620a8329-a904-4ea5-a6ac-117f2a5c2890,5,How can I get back my account My account is banned And am not a spam,11/25/2025 21:18,0
5ef1e0c5-c69e-418e-88e5-7cafbfa6cae5,5,i really love this WhatsApp business so much,11/21/2025 22:07,0
791217e1-68d7-46a4-947d-f1302b75b071,3,How long will you take to add a download button or status saver,11/26/2025 15:15,0
2aba587f-3921-4bf0-88b6-cf97176ba49b,5,just the best,11/23/2025 15:37,0
NuqJtTDx-4DIy-0eiu-gkpJ-XLbMRG4KaULp,4,rrrrrrrrrrrrrrrrrrrrrrrrrrrrrrrrrrrrrrrrrrr,22/11/2025 03:12,0
