review_id,rating,review_text,review_date,helpful
24adbcb4-0e68-4718-b6e8-d5dacbe2e455,2,"Developers! Update your music libraries! So many songs missing, one can't even upload a WhatsApp Story properly and add the applicable song because the current choices are limited! Go get a partnership with Spotify or something",11/25/2025 20:17,0
3e133853-484c-4519-8443-4ef60264329d,2,I think there is a bug in the Read and Delivered section. First of all 2 Read and 2 Delivered can be seen for a single chat even if that is made in a DM and not in a group. And secondly the Read and Delivered are always the same for every contact.,11/22/2025 11:43,0
nui0gpRg-sYEH-LXgB-Wbet-aR9kozwzj8cP,5,yyyyyyyyyyyyyyyyyyyyyyyyyyyyyyyyyyyyyyyyyyyyyyyyyyyyyyyyyyyyyyyyyyyyyyyyyyyyyyyyyyyyyyyyyy,22/11/2025 22:53,0
41917b94-8254-4756-8009-24e3274c5f65,1,the new upgrade is very dangerous for young people. now the statuses are at the top and channels show below and it changes during the day and I have seen R rated channels being displayed. there is no way to control age appropriate content. we will surely find another communication platform if this is not sorted out.,11/25/2025 13:06,0
5f99e404-4cc6-4b74-b25b-3a86c7f965c8,5,good app,11/24/2025 2:55,0
5e9566c2-f83d-42cb-907b-b89806f09d08,5,Can you add a feature to choose who can OPEN ONE TIME VIEW in WA Group member,11/23/2025 8:58,101
88c349b8-3f4c-41f6-8e56-654c47542cad,5,Nice apps for communication I really like how this app works,11/21/2025 22:58,2
c328071e-2d14-4c07-8fe5-9016641218f9,2,It is not working 😭 it has refused tolet me use and it has blocked me for no reason just for spamming and yesterday it was just working the person I talked to just had bad WiFi 😞 so Whatsapp you need to sharpen app,11/21/2025 22:08,2
731b6643-baae-43c8-82fe-f7da720e85a1,5,excellent please why are mine not able to use my WhatsApp they keep blocking me since last Sunday. what is going on,11/22/2025 16:59,0
92d0d4bc-f65a-44a5-939d-22b790a31737,1,whatsapp be stealing information and sharing with the government we don't have any privacy everything it's linked,11/26/2025 1:01,1
7bf80173-1a1e-4b33-bd4d-321d26a102d0,5,Its good,11/21/2025 21:13,0
c0b8b975-06b7-4e1d-83e8-0b11f1ee39c4,1,my audio is not working,11/22/2025 14:19,0
8113ecb2-e14e-44f3-b2b8-f0cdf4dc0bf9,1,my meta is not working he is not replying,11/25/2025 16:54,0
67d45661-11de-432e-a126-95ebc574f48a,5,"I’d love a feature that shows a microphone audio waveform during WhatsApp calls. Right now, there’s no visual indicator that our voice is being picked up properly. A waveform (like the one for voice notes) would help users confirm their mic is working and improve confidence during calls, especially with connectivity or sensitivity issues. Thanks for considering this improvement!",11/24/2025 18:28,0
63909798-58d7-4624-8fdc-1d4230ae031c,5,please my whatspps is big problem please recover my account,11/24/2025 23:59,0
b59fd597-955d-449c-8fa0-9939d941ec61,5,So perfect and amazing since I've been one of this WhatsApp user,11/22/2025 23:17,0
552cae1b-47a8-492b-adc9-fffc002c7960,5,unban whatsapp,11/26/2025 20:02,1
6e849735-6fc2-4789-9233-53674e59780c,5,It is such a good app,11/24/2025 21:19,0
walSiSYv-gdwe-FdER-eBay-D9cSNckPPqFh,3,analyze comedy limitation garlic voter explanation set silent framework horse initial cookie size positive observe testimony speed seek woman fighter link depending formula son shelf tax project artist appointment wall plenty energy friend four Mexican gender manner foreign loss build provide modern Russian alive reservation,25/11/2025 11:11,0
da7a4673-27db-470b-b861-3e8d0414d1dd,4,I love the app but when you change your phone and you don't back your chat up you will lose them,11/22/2025 11:28,1
efcd4ea1-66f8-4427-8b94-97e677357a6c,5,ca t live with out it in my life it's been my go 1noe App Get it see how easier your life will be ¡¡¡!,11/25/2025 18:22,0
513a2d7e-c379-4400-95ac-db489be287df,4,best of,11/24/2025 11:44,0
ffc0bb4c-c8a5-47a2-b93e-0cdf05a05b94,5,need update,11/22/2025 20:51,0
a403ad68-c567-49b1-b3f0-dfbf39e2d447,5,it's a good app,11/24/2025 21:51,0
e53ec248-5ddc-46d6-8b8d-399a11eea81d,5,whatsapp is one of the best app,11/23/2025 19:29,0
e03b6264-fca6-4ef3-ad04-88a9e0e8d0f0,5,it is a good app,11/22/2025 18:46,0
b79abee3-1070-42d7-af26-72f3e858de69,4,my whatsapp account may be hacked that's why I can't be possible to open. please solve my problem,11/25/2025 16:18,0
6d10545c-5507-4d9a-8473-fe6ac710a1fa,4,I'M REALLY APPRECIATE FOR THIS APP,11/24/2025 15:16,0
e17706fb-dbc4-45d2-8b42-416c3933b181,2,"As much as I think WhatsApp has been an invaluable resource I've grown frustrated with it since I started using multi-channel group chats (""communities""). When opening one, it goes to the channel with the most recent message, hitting ""back"" returns you to the main screen, only tapping the community a second time lets you see all the channels. It's incredibly counter intuitive and makes me feel like an idiot going back and forth between chats when opening the desired one should take two taps.",11/25/2025 5:29,2
38151acf-4426-4699-bad2-355391130ed3,5,Very good useful app,11/25/2025 8:10,0
GBTsgbCa-LmQ3-HLq7-8C8O-JtIlTOWTwgnh,2,cheek cheek cheek cheek cheek cheek cheek cheek cheek cheek cheek cheek cheek cheek cheek cheek cheek cheek cheek cheek cheek cheek cheek cheek cheek cheek cheek cheek cheek cheek cheek cheek cheek cheek cheek cheek cheek cheek cheek cheek cheek cheek ,24/11/2025 05:41,0
0212b922-b4b1-4d4c-8a6e-fd347875cdd9,5,Great,11/26/2025 12:43,0
8ec2a3e2-1f48-4770-a053-0b81c5383d62,5,"Very impressive and very convenient,I like it, everything thing about it is very fantastic ,whatsApp is my day maker it guarantees my smile You guys should try it and you will not be dissapointed",11/22/2025 20:11,0
00baeac2-f1f2-40d4-9b20-e16af435f4de,4,"""Hi, I've received a message saying my account has some restrictions. I can still answer calls and reply to messages, but I can't start new chats. Can you tell me why this is happening and how I can lift these restrictions? Thanks!""",11/21/2025 22:51,1
7135f0d5-1083-4872-83b6-a78384a9e870,5,unblock WhatsApp,11/24/2025 10:07,0
fYZt00tQ-3ae4-eQdC-sAqv-TtQz1VMEWniB,1,xxxxxxxxxxxxxxxxxxxxxx,24/11/2025 15:48,1
176d8747-7c45-4d19-b9d9-b9720ab191aa,1,my chats aree not getting backup,11/24/2025 21:14,0
07f86e5b-15e7-427f-9baf-ed18a40efc85,1,I can't update my WhatsApp,11/26/2025 17:24,0
d9bf8080-29b8-4771-8cc2-94233042dd75,1,Can't download whattsapp,11/26/2025 9:04,0
7ec368f4-6175-41b7-a89c-8fccc2df69f1,5,Super App everyone Try to Download This App,11/22/2025 14:38,0
dd5a5b0f-8c65-4137-8a12-217d2ac8009a,4,hello team whatsApp my account is restricted for my some contacts. kindly review and resolve the issue as soon as possible. I am looking forward to your positive response,11/24/2025 14:55,0
c6aa9061-4116-422a-9c74-82bd8793b51d,5,This app is so amazing!!!!💖,11/23/2025 20:48,0
b605b41b-7690-4e5d-8a82-8a703fab1f06,1,why do I need to update my WhatsApp this is bullsh,11/23/2025 19:19,0
d58d2c38-732b-4f1e-a507-4f30c0d74af8,1,Having issues with sending voice notes straight from statuses. Also why is the search bar only available at the top of the chat list🤦‍♂️,11/24/2025 2:49,0
a771c15d-bc88-4bd0-be6c-1bf5cc44e9b3,2,I thank you,11/22/2025 20:13,0
b17993f8-514a-4b9a-b170-7e5472d8e655,5,the best app ever,11/25/2025 2:35,0
ycVECBka-PXq4-6lBL-HQhO-kqM0jSO0xfzs,4,BK85v8jBDuWoQwOnfWuYfFxCrG4DK,24/11/2025 16:55,1
dbe0b9d3-7e59-4e08-aaa6-85b7ca1d1d42,5,the World of populer best massage app WhatsApp,11/23/2025 13:48,0
D42wH3Hg-dAcL-dD6j-4REQ-NKu6eAqjTRqT,1,HHHHHHHHHHHHHHHHHHHHHHHHHHHHHHHHH,25/11/2025 20:13,0
7a278168-4801-48cd-b8c0-99274de59ee7,5,I never see this kind of texting app before,11/22/2025 23:42,0
0a61353a-2e53-4a9b-aab7-72eea8c9058d,5,it's been fun using WhatsApp,11/22/2025 22:37,0
86d4b3c9-8d37-48bb-9f5b-8ff84b625f4f,2,It asks fingerprint to unlock. But then stucks at black screen after unlocked.,11/25/2025 23:52,1
36100b63-328a-47a1-b6dd-3fb0526282d4,5,i want to work with the wassapp,11/24/2025 23:16,0
657eb727-0d3a-4dd2-8261-0d5e994706ad,1,Trying to force me to give up my contacts. I can't share with out copy and pay link bc of this. The new update won't let me create a new message or save changes to people's info with out giving accesses to my contacts. What's the point in the privacy of this app if it forces you to allow it to collect all your information. If i could give this app negative stars I would.,11/21/2025 21:24,15
8111f5c3-c3ea-4935-8dfc-80e6d92a83da,5,"WhatsApp is a popular, free messaging app praised for its reliability, user-friendly interface, and strong security features like end-to-end encryption, which are great for personal and business communication. However, some users have privacy concerns related to Meta's data practices, despite the separate privacy policy. Common drawbacks also include occasional bugs or poor call quality in certain network conditions, and some users feel newer features make it less simple.",11/25/2025 12:56,0
12ac90e4-7049-4727-999e-613c08814333,1,Hello whatsapp team my whatsapp his fast time band now are inband thank for the help,11/21/2025 20:33,0
d90badc4-674a-405d-8949-4fd007b55773,5,"best app for communication and message ,better for people user",11/24/2025 0:56,0
15356e8b-4f5a-43ac-8b03-363c3a28ab0e,5,the best message app,11/26/2025 19:22,0
3a17a8c6-22b9-4e34-9d0b-f5c506f1dc4f,5,keep my account active 24 hours,11/26/2025 5:59,0
9bdcd1f6-42b7-4d8d-8dd3-d1aed04d2775,5,I love whatsup,11/23/2025 12:03,1
bdb793a5-5c43-4e1c-b2c3-d533ead7ad95,5,whatsApp Mess,11/22/2025 14:30,0
aacc448a-0825-4db8-b297-4ebf1ba08e0a,1,"I don't know why this app is always out of date in one month , every time out of date",11/25/2025 2:23,0
4e988f87-b44b-40f6-8ce3-af55507c3f96,1,I can't remove people in my lock chats. I tried to uninstall the app and restarted my phone but nothing works. That why I gave WhatsApp a one star.,11/23/2025 21:42,0
0c8c5a8c-416d-4f37-83ea-962ac3c06e04,2,Stopped notifications and not working properly,11/23/2025 21:29,0
1532433b-65d9-4aa2-ba51-b75a0f1a1beb,5,please 🙏 riseu my WhatsApp please,11/24/2025 21:35,0
a1708585-0c8c-4604-8812-9bbb4431a7e6,2,very bad servics this what's pp third class services,11/21/2025 20:03,0
c135f8ac-cab8-47b8-8f58-bc60a582810f,2,still waiting for verification call,11/26/2025 18:04,0
30ead4d2-880f-438d-8216-be31f6af68b1,4,the back up is not working,11/26/2025 13:48,0
14d59889-2aa3-49f1-ab82-4436947b2fc2,5,I'm just a new beginner but I hope it will help me as I was using WhatsApp Business right,11/26/2025 17:12,0
3eaf4b59-3c19-4630-ad21-354997eda7f8,1,salaam sir mara Whatsapp account achanak band kia hai pls open my Whatsapp account sir ma hotel ma Kam karta hu tu sb ko payment k hawala sa bat karta hu I am account offers pls open my Whatsapp,11/25/2025 22:28,0
30d07043-3ae9-43f1-9fa1-f91e5ae757b0,5,Great and awesome,11/25/2025 2:43,0
07732284-8e9d-4132-bc90-7eb6a948375e,1,Deleted. Deleted. Deleted. Why am I still being asked about an app that has been deleted. Not functional on this device.,11/23/2025 4:29,0
fa55958d-ed21-4dd2-8835-d97117430bc2,1,"I'm having difficulty removing channels I don't want, but when I hide them, the ones I don't need continue to recommend themselves. Why?",11/25/2025 13:20,1
05a6ddca-ecd8-4d69-b235-beaec6c6e5ec,5,"I can't update my WhatsApp messenger, should I do",11/25/2025 0:12,0
857d4c4c-f0dd-457b-8152-3b0571c68295,5,"I really love this app, it is the best in all app without this app we can't send a message",11/23/2025 2:00,0
75bafc85-b311-4149-80a2-1f6c98a20246,4,My account has been banned twice in 3 days and i can't seem to understand why,11/24/2025 8:23,0
cb900d97-ca5b-4ebe-ac86-407623553838,5,"I'm in tanzania i tried to open whatsapp acount by using Vivo x7 phone but i couldn't,it ask me official whatsapp how can get it? Please help me",11/24/2025 2:03,0
d38431cf-0f65-4ea8-9558-dd137884d1af,1,yes I'm giving only 1 star because you keep disable my account without violating the terms and conditions this is so annoying 😡😡😡😡 fix and restore it back and will come back to give a 5 star review,11/23/2025 21:52,0
fcc213c5-0008-4fc3-a495-bb1937d7f772,5,its a Nice App To the Source of Communication💞,11/24/2025 15:45,0
7879891b-fe11-4211-a454-243046992c24,4,It is good app,11/25/2025 16:56,0
7a3b70ad-f005-48df-b5ce-1ad0d9e08605,1,it is giving me problem to sign in,11/24/2025 15:51,0
02f27a89-d331-47b1-9447-3219d1c7acf9,1,youtube links no longer sharing a thumbnail of the video being shared.,11/23/2025 1:17,0
21de077e-81f6-42af-9f25-eb87fa03e4b0,5,what's app not working,11/25/2025 16:31,0
nfTIvhs8-NZBS-wCFy-RJuU-plUwEJad4dVa,3,4444444444444444444444444444444444444444444,25/11/2025 09:06,0
oPNfMmAw-QJVJ-bd0p-MxNf-cd4jfRxUcODs,2,we car slice victim threat sit action tablespoon tiny usual drawing prepare well grandmother fee gradually aid initiative maintain sufficient message she position positive gifted diversity scheme remind hearing gang prospect rose Canadian bed management journal cook assist farmer strong therefore moon restriction eager lower testify participation,26/11/2025 19:41,0
5f523c92-5c37-4dc4-85b2-d46586d1d04d,3,"I use the same phone for WhatsApp and Messenger, and the audio message quality on WhatsApp feels compressed and dull, unlike Messenger which sounds clear and crisp. I hope WhatsApp improves audio quality and updates its interface to be more like Messenger for a better chatting experience.",11/22/2025 6:46,0
3273a117-02e0-483f-b815-d345ad3ccaad,1,"My WhatsApp is not working, you're asking me download and nothing seems to work",11/25/2025 13:52,0
ac891eff-fe67-4551-a0d6-68dcc27292aa,1,stop update dude my phone memory full !,11/25/2025 4:19,0
6979eebf-0cf1-48c6-92eb-abf9bb77115f,4,new update doesn't allow you to have your about show for longer than a month,11/26/2025 13:46,0
466e2f99-723e-4d9f-b2ec-7457bdcb01c3,5,it is my only communicative channel that is fast and easy in just few minutes,11/25/2025 17:01,1
3e1f87e6-4b21-4d10-a135-27af6b1d0b3e,5,good app,11/26/2025 16:35,0
19e3e9e1-b62a-4cdd-a089-40ebb47d9252,5,nice app work and helpful and fast,11/24/2025 21:43,0
92349d5b-4003-4e22-8c14-fc43f2e79be2,5,well experience for whatsaap,11/26/2025 11:14,0
6faa6b7a-fda4-4f1a-9d2c-7df2d6ff9d1d,5,I want this app but I do not know how to get it and I wish if y'all could help me and people having the up so I really interested at the app how should I get it open could you please help me please I really want the app I just want you to help me please please please please please please the way how to use the app how to have the code how to how to log in massage my day if I helped me so I could get a better suggestion that you could,11/22/2025 4:23,1
4c379d28-1917-424e-8208-cf0ad353fe59,4,"WhatsApp should quickly release the new username feature for all users. It’s very useful because it allows us to chat without sharing our phone numbers, which improves privacy and security. Just like Instagram or Telegram handles, usernames will make it easier to find and message people safely. This feature has already been tested—please make it available worldwide. We really need it!",11/24/2025 19:00,0
a4fa710a-cec0-4db5-b6ee-3ce8bf27d80f,1,"I will never ever, ever, download this app again. Not only did they refuse to let me uninstall the app but there is no way to delete your info. Never again, not a safe or trustworthy app!",11/25/2025 14:34,0
c7721ad1-c910-43bc-95f2-b113f03d5434,5,thank you 🙏😊,11/23/2025 5:53,0
76b19aa1-f4f6-43d4-9a35-2018009170ae,1,I don't get WhatsApp notification anymore good bye,11/22/2025 11:30,0
2e7e1219-9219-4a4a-b8c4-54dfe450042f,4,This app is awesome but the option voice chat is not required and I don't vote for it.,11/26/2025 14:05,1
fcd4b367-f8c4-4a37-8674-c1b81a6d69ec,4,Great,11/21/2025 22:17,0
b6916365-0eb1-41db-8a9a-29e46b9b1424,1,can you please add the hd features on status I don't like to upload pictures in bad quality,11/25/2025 4:02,0
nZzzxPUv-6aN6-rPkL-kuwr-f8iLIaKZsQ1H,3,gFbBQdsOcip6HdlmEulPefDfpVWVBB,21/11/2025 10:53,1
3e7358b9-72fc-4871-9b47-965f4649fb58,5,WhatsApp doesn't block unknown contacts you should make a privacy so that any unknown number couldn't send any text . currently by activating block unknown messages in the advance section unknown contacts can send messages to you.,11/26/2025 16:38,0
c0be59b1-523f-4c23-8048-3650851540e5,1,Too wide so I need to delete some app before installing it,11/23/2025 11:54,0
93929560-e03a-45cc-bf2b-a8358787a4ac,1,the WhatsApp is not working on my phone,11/23/2025 19:59,0
6cec9313-7e43-4405-8a38-d9e88deb6798,3,my backgroud is green and can't go back to normal.,11/22/2025 18:17,0
e6NfP2cc-P04d-eqG2-zt9L-o2dE5kPk09AE,3,Q5kwRYxIHCSDUeAn2DLnCp9ZaH7kwqAcQtHkbfX2iSasWAbPq2r03Olsv2v4hGv58djwbpnL1tMAyRGpuXBNsZsQdF,25/11/2025 16:21,1
15aba7ca-d2dc-4675-85e8-8c2ffc8d75d7,4,The best app I've used so far,11/24/2025 20:50,0
a9e63c10-69ff-4dbf-b9ba-5b887b32d1f0,1,Previous version was much better,11/26/2025 3:09,0
5441a848-5ed5-4f20-81ef-303f62e185f8,1,unable to see others whatsapp about solve this problem,11/26/2025 19:36,0
110f4e17-8781-47a6-be7e-aaa4a2646332,5,Good for daily use or for contacting people,11/23/2025 10:51,1
970b6051-240f-4720-8f16-98f02c3b2ed0,5,I love WhatsApp for my aducation,11/24/2025 21:46,0
d5dde7b6-7013-414d-a530-b2d97e2369eb,2,it's the best app I have come across because we get to share lots and lots with friends and relatives❤️,11/22/2025 9:51,0
14ff6dad-37dd-4999-8715-470c5418f84c,5,Good but when being installed so people be causious of your data Thanks,11/23/2025 16:41,0
098b5a15-5293-4ebd-80bb-ddb06207641e,4,Avery good and friendly app,11/25/2025 0:56,0
ff1d87e2-e66b-49e3-8ec4-4909fcaa3144,4,apps is very slow to respond,11/26/2025 10:09,0
2a7ef8c8-4e79-49de-9dcf-bef07c15fe9a,1,my account is banned,11/25/2025 20:16,1
6da5a983-4d90-401c-82ba-07aee3a19e11,5,I love whatsapp,11/23/2025 14:48,0
ac1a5b16-21e3-4fcf-b12c-101a2b221c9f,5,Good app,11/26/2025 4:13,0
467bf150-0f6a-4787-ad4e-10dbb16a0936,4,"Because I can chat with my school friends without paying any money , I like the meta ai it is not a human but work better than human.",11/22/2025 6:50,0
7bb11c86-535c-437d-8aed-d2377cf4a5d9,5,it's very nice infact I give this App excellent,11/24/2025 1:05,0
WNhiQOHC-8I2P-oWjW-med7-4IGkaXcN3A1I,4,oooooooooooooooooo,22/11/2025 18:04,1
7edd7325-496f-46b0-89f3-bb4de6023331,5,chate,11/23/2025 17:14,0
9a771c72-cb86-43c5-9d72-52746989f635,5,this is so good,11/26/2025 2:58,0
45e610ad-4b85-4722-88e3-0b4911ccc3db,5,photo gallery,11/24/2025 17:05,0
usq2QqX0-mazl-UChx-Cs3a-ZzODDwte9nlj,5,SNVKTAkVOZKuyFvPXV3wV4e0pXfwFH8cdKFUtZQoDSI8mILSh4RV23cpzW43YRmO7TPXdJzjUtc,25/11/2025 18:28,1
d3a7d743-51f2-4930-a248-7b401a2d00d0,5,"It's frustrating that when I record a voice comment on a status, image, audio, or video sent once on WhatsApp, it doesn't send. Could we please bring this feature back to WhatsApp? Thank you.",11/24/2025 18:12,0
17881380-2f98-4a6f-9739-aedbc1c4e30c,5,very cool,11/25/2025 5:05,0
b82f8915-cf74-4ebe-83d7-663e58ef6ce9,5,great app,11/26/2025 19:12,0
8b53020f-d9b3-4ef6-943f-b3f12f368570,5,very helpful,11/23/2025 22:05,0
CZ0459Zv-EIXb-Y0p9-TAHU-vjOIG0Wo5fAh,4,GCHKGA434NW4IndpFKhVcxdo2ICkKVuY9MsjWAgsWwRZ4Z4PVHq1t1sC7TIaapnTVyAhcHH3dOtE0j8XNgM5tlrd,22/11/2025 20:58,0
cd2e8678-a2c8-4764-9778-810012652b0b,5,this app is so wonderful app,11/26/2025 10:53,0
133e2126-3e0b-422c-8762-6f65cbffe720,2,it is not working properly. Ads coming,11/22/2025 12:47,1
db08ee78-38c9-46ce-ae43-e0003d07e20e,4,it's working nice,11/22/2025 13:28,1
66e3f581-204b-4b6e-8a58-8c99ca50b357,5,"Good, but help us to make use of free data mood",11/24/2025 21:27,0
8bfa92f7-d053-4b91-be41-9d8ae1166f25,1,My WhatsApp has been closed by WhatsApp without any reason. All my work data is on WhatsApp and now WhatsApp keeps saying that the account has been closed but why was it closed? Please tell me.,11/23/2025 8:13,0
9a3cd6e1-c0c1-4cdb-8cd4-40fdb6359046,5,sorry sir place My account unbanned from back to use WhatsApp only fast and last warning 🙏,11/25/2025 14:49,1
5a25d1a3-65cc-4490-b3a2-7b9c726c1753,4,Dear meta I request u a simple thing please make the option of read receipt little bit expandable means atleast we should have the option to apply it for certain people only if I want only my family members to see blue tick then please make it little bit expandable,11/21/2025 22:51,2
df0672fd-48c5-4ff6-8a35-2125a69f66ef,5,my whatshp note ricepve otp soluson,11/24/2025 13:53,0
32a5dcff-56b2-48fc-ba23-1921e9973b4d,4,"okay, more filters for video call will be much fun.",11/23/2025 8:37,0
c6021bda-61b5-4f78-bafa-933be9ebf496,5,it is so useful for me,11/26/2025 20:52,0
089d0ec1-0071-4b8e-b05e-8ec0fb6cf8fc,1,very stupid way to support with the AI never gives a solution never understands the issue and only able to understand English it's very bad very complicated and even in the community can't find something related,11/25/2025 3:17,0
fc1f59fc-49b0-4145-8653-41d8bec716ac,5,super exiting updates,11/26/2025 6:40,0
0e4c3298-3e1f-4961-a27e-6751c5be6d78,1,very froud in WhatsApp permission all number for use whatsapp,11/26/2025 11:09,0
kqiHvDUD-ShXc-pw4B-ObwR-dq6WYh56e737,1,fffffffffffffffffffffffffffffffffffffffffffffffffffffffffffffffffffffffffffffffffffffff,24/11/2025 23:45,0
hKtzhNcO-c7yx-riPA-4kIi-kNqNxwka9i5Y,5,jjjjjjjjjjjjjjjjjjjjjjjjjjjjjjjjjjjjjjjjjjjjjjjjjjjjjjjjjjjjjjjjjjjjjjjj,23/11/2025 08:04,1
09d1d77f-756f-4b7b-976f-2f20bf0439f8,5,This is a good app,11/24/2025 0:44,0
5715968e-5029-4378-a8f7-e198c8d2fe56,3,this app make me feel better,11/25/2025 2:34,0
GgKC5fFb-uALv-UL8v-gGGK-2vtiU68lg5BI,1,999999999999999999999999999999999999,21/11/2025 08:16,1
065ee694-6c41-4ea3-965a-5849e26fee87,1,Bad bcz its keeps on logging out,11/25/2025 20:33,0
897cd81b-c3e7-40a4-a457-eead5df6ab68,3,"what did you do to ""about"" we already have statuses, why adding another message which automatically disappears",11/26/2025 8:12,0
448154c3-ddd1-41b9-b6ec-ff0f1520ce48,1,someone linked my WhatsApp without permission how do I do link it,11/26/2025 4:08,0
9ddb426b-4947-4e37-9f83-c16cf3241836,5,good apps,11/25/2025 21:35,0
4b316287-5bf4-40fe-bbc3-239cdd9f90b8,3,Don't give gifts or mb but it's a good app,11/26/2025 11:55,0
36fd5921-6e34-408f-ab6a-e3ab681a1af0,5,In fact it's more than any other way of communication,11/24/2025 23:26,0
4FFgW7If-5ukw-YdGH-s6Zq-IWZaqksSFXga,5,simply simply simply simply simply simply simply simply simply simply simply simply simply simply simply simply simply simply simply simply simply simply simply simply simply simply simply simply simply simply simply simply simply simply simply simply simply simply simply simply ,22/11/2025 05:48,0
86d6852f-5c8c-4d07-8b41-90bc601ee9da,1,I've lost my number since 22/11/25 until now.. still can't log in.. this morning others person using it.. try call and whatsapp back no reply.. please help me.. so many emel with your side already.. please..,11/24/2025 11:25,0
856be840-2878-4a83-b9c3-d024a64579a9,5,very useful app ever 👍😎,11/26/2025 21:29,0
425dff90-2d39-463c-a35b-41b2c88124b4,5,Whatsapp has no issue,11/23/2025 15:49,0
bfd2d1a1-57f4-4482-abf6-59dd2dd521aa,5,it's not just an app but it's everything to me,11/26/2025 17:22,0
40fdc69e-1aac-4932-8a15-5f19e7db03f8,5,Because it is very slow plaease check it,11/24/2025 20:57,0
21d37bc1-0928-4173-9fe6-beb0205e35d5,5,This app have look good visually,11/26/2025 13:25,0
470e81be-02ab-48a0-8490-2a05a6951b4f,5,"Subject: Request for Review – Permanent Ban on My WhatsApp Account Dear WhatsApp Support Team, I am writing to request a review of my WhatsApp account, which has been permanently banned. I believe this action may have been taken due to a misunderstanding, as I have always tried to follow WhatsApp’s Terms of Service and community guidelines. I kindly request that you review my account again and restore my access if possible. Your assistance will be greatly appreciated. My WhatsApp Number: +92",11/24/2025 10:30,0
1ec80ef2-a2bf-412b-a69b-3dc2257eedd3,3,red exclamation mark comes up. won't send messages and app up to date,11/22/2025 20:13,0
c936abdf-c650-48fd-98d8-9011e5db9e31,1,hello people I'm research about term of service of whatsapp I don't why is not activate to any phone version,11/23/2025 11:40,0
4b98af04-97cc-43ad-8e74-79561aa3362b,5,my account is saying my number is nolonger using whatsapp,11/26/2025 18:01,0
psxHyjEH-3Tzf-2okJ-hkT9-omLBJS029FvU,4,1GOsUki3NLhwE5k5Ge1ayooaxtWTPPVrwFpDx4zNddP5faxsP0bft1t,25/11/2025 01:25,0
0b922a7c-dd29-449a-b624-bf1d819e6802,5,💯 free communication,11/22/2025 22:05,0
ZXfppBVA-gHIr-zLE6-bRvH-KOXyXHu7bRcz,3,lover alcohol herself dining involve publisher toy bunch estimate pain suggest external dark collect governor rock whole add shade proof totally Indian channel heat entrance oh smell car single benefit discourse Christian vacation alive wind security ticket twice wonder bread better cast them fence weekend argue overcome result pipe final pack silent interaction alter consumption schedule quick remote extra estate mask knife cell hundred whenever fee workshop mayor approach naturally release terms cry prove plate speed offense hope Mexican change appropriate downtown preparation awful level reinforce grow difficult God easy stuff three homeless murder protection pain shore worry cultural,22/11/2025 14:24,1
pRmhefzo-0j2D-9ioG-Fh6D-qSLmKDDxqURo,3,7777777777777777777777777777777777777777777777777777777777777777777777777,25/11/2025 04:14,0
2371d0ea-d934-44bf-98ee-75febe995c4a,5,open the whatsapp,11/21/2025 19:54,0
edf0dd9d-29f1-4753-8246-274273f85965,4,is very nice and secretive,11/23/2025 0:10,0
51af7de2-4b39-4ad8-9dbb-f600140c18fa,4,whatsapp app continue our cell please added whatsapp app,11/25/2025 17:58,0
