review_id,rating,review_text,review_date,helpful
981e465b-d3ba-4632-9c60-25051efac38a,5,It's good,11/22/2025 1:19,0
964d3555-9429-4c20-8127-ce3c71ce9273,5,WhatsApp not working well always shows offline please sort out my problem,11/24/2025 20:03,0
6c28859f-1554-4ca1-9aa8-9d66f204be0a,5,"Oppo not corresponding, share with me the official app( oppoR7)",11/25/2025 6:26,0
a7efafc3-5871-4020-a398-9cc12cb4072a,5,"Excellent app, great communication super connect that wonderful easy to connect especially overseas platforms",11/25/2025 18:09,0
de142b31-a5ad-446f-b7c8-51b264728478,4,simply the ɓest for chat and calls.i love it,11/24/2025 1:10,1
8b0ffc3b-d7d0-4198-8ce0-763674359246,5,good. but i need WhatsApp premium features,11/26/2025 16:42,0
XCdQN9L5-PsBJ-ftUV-Ov6H-Na1v3f0JxTLs,4,learning learning learning learning learning learning learning learning learning learning learning learning learning learning learning learning learning learning learning learning learning learning learning learning learning learning learning learning learning learning learning learning learning learning learning learning learning learning learning learning learning ,25/11/2025 06:54,1
18294fa1-0410-4476-970f-33f188b0abfe,5,Awesome. I just need it to download and install,11/22/2025 20:27,0
c9fd6209-d8ed-482e-9b03-68cc2100fed0,5,very nice app thnx so much,11/22/2025 15:53,0
75b5068d-6b9b-4aa6-a069-abdb6bfc6388,5,Really really apriacite 100/,11/26/2025 17:06,0
af00686c-ff52-492f-8226-206ebce0581e,2,whatsapp web not working camera Focus not working,11/26/2025 17:29,0
accb4824-3408-4741-8e7d-5c99872e6490,5,Nice and good to use,11/23/2025 14:14,0
75d35c41-f867-4b54-b591-59112abee52a,5,This account can no longer use watsapp due to spam kyu ho raha hey,11/24/2025 19:49,1
yCFYcpXx-Pbbd-pF7p-8QVK-RkohTQWNE5Fq,4,forever controversy workshop lawyer carbon insurance hide glad violate raise good rush cop blame adolescent intensity lower opportunity survey steal burn bag adventure board option,21/11/2025 16:27,1
a3e28ea7-8ea6-464b-a0d2-b8fdab207248,4,"I've been using this app for years and I just absolutely love all the features. Recently the app has introduced a new chat lock feature and I would say that this feature is a very needed one as well because I've been struggling with some privacy issues (personal). I cannot use this feature on my redmi 8a dual because it's an older phone, and I'm terribly disappointed. Could you please let the users of older phones also have this feature, it would be very useful. Expecting a quick response☺️",11/24/2025 19:37,8
nYcuceD7-gxtp-dthp-lHUr-8OGICGAiTb8p,2,AAAAAAAAAAAAAAAAAAAAAAAAAAAAAAAAAAAAAAAAAAAAAAAAAAAAAAAA,23/11/2025 18:00,1
a4eed4c4-acc6-4208-bb2c-ab2cebffb687,1,They banned my account more than 9 times I didn't know what I did,11/25/2025 0:15,0
70723c52-cf26-4d85-b444-f5521f2aae4a,1,i can't open my whatsapp whenever i open it.. it close automatically please help its very urgent,11/25/2025 23:58,0
1bb4e283-d52b-4ffb-9e81-1f80c27baa0b,1,Bad every day ban what'sapp,11/22/2025 15:00,0
dd96f58c-5f97-4fb5-b315-94e6f59de624,5,It's the most convenient and easy-to-use application for a communication with your international friends/ colleagues/ customers 💚,11/26/2025 14:37,0
1e8c2e8d-3d12-46b1-aceb-00cc0e3a3024,5,Install it very good application,11/26/2025 18:03,0
11ee0460-eb73-4226-870c-a6a5941fe56c,1,My whatsap was hacked,11/22/2025 17:26,0
JL7Nw9Xg-NOYH-wtZJ-2C9R-1i7CjkVI50Be,5,uVlIUP6rZOwbnKA9nUZiWqxC61ia2hHBs2L52NyTHS4nLs,23/11/2025 12:05,0
e7407e3d-c68c-482a-b169-05ccc0b5e6ba,5,Not like others.Its better,11/22/2025 21:20,0
ff759721-b5c4-4b29-9d61-353ceb480729,5,I'm still a novice with this app i need help,11/22/2025 0:26,0
wL1D5oj3-WWMC-WuG1-lqst-M4JainRDRm2Q,4,aHU4DCtH2mD9rhBxdZwXPAkfhASrXQTvktLUq3hSNkcd0EMIQVfZqEE8zL4ORd45u4k7uOiOXMxnyY0tnN8lBQBSMh4gh,24/11/2025 18:08,1
c5f103fb-d79c-4b98-a76c-1e8af4b0910b,1,WhatsApp are poor quality server,11/25/2025 19:18,1
5bdee32c-560e-46c3-98d1-e1dc3354fe72,5,I want to upgrade my WhatsApp please,11/23/2025 13:56,0
fdfa7e1c-ae65-4459-89db-708c02b5bf16,5,nicely done,11/24/2025 15:43,1
48da934c-0dbe-431f-807a-da1612977167,5,my name is Amobi Chris I am giving Whatsapp 5 Star review to show my appreciation for restoring my account back to my. I love Whatsapp 👍👍🤝,11/26/2025 0:33,1
47618a8d-c6bf-402b-8f89-5cf9787b8be4,5,Better than viber and skype. Thank you for giving replys .. Bye,11/25/2025 13:34,0
7955ac96-a729-4e41-a6a1-4fedb67b33ea,2,Chat wallpaper flickering this update😵‍💫,11/22/2025 12:06,2
d52f5c0b-9e1d-47c2-b5fb-71db7b32cdf4,1,I Try to change my number. I did not get the code. Now I do't have whatsapp anymore. just a permanent screen that prompt me to send a code that don't work and it doesn't show my chat anymore. I cannot use anymore. a QR Code would be so much better. I give you 1 star,11/22/2025 20:20,0
a1983bf5-96f4-4de6-a916-8c43144e8c99,5,use Facebook Account,11/25/2025 22:50,0
fa623735-2814-4d47-8605-3a1c5b8d371f,5,It ok,11/23/2025 6:23,1
faba54b3-eef1-4e5c-8fa8-1ff59e50c669,5,very useful app ever,11/23/2025 22:24,0
oDdtdxXE-A4fr-99kC-poIM-QtTcOfkIvMzG,1,truly truly truly truly truly truly truly truly truly truly truly truly truly truly truly truly truly truly truly truly truly truly truly truly truly truly truly truly truly truly truly truly truly truly truly truly truly truly truly truly truly truly truly truly truly truly truly truly truly truly truly truly truly truly truly truly truly truly truly truly truly truly truly truly truly truly truly truly truly truly truly truly truly truly truly truly truly truly truly truly truly truly truly ,22/11/2025 13:02,0
21f949a2-4ad7-4f06-824a-c1bfeb859218,4,thanks you,11/22/2025 15:01,0
852b2a13-456f-4bc8-b25b-f7ed8c89fa04,5,this is so straight enough imagine sometimes it with only 3mbs that's amazing,11/26/2025 11:29,0
50d9ee82-1d42-4793-87d2-44409c30636b,3,my whatsapp account has been blocked by forgein country please recover my whatsapp account thank you so much 🙏,11/22/2025 18:18,0
28115ad3-cfaa-4f30-94a1-7bf1f31fd62a,1,"I purchased a new SIM today.Then opened WhatsApp with the number.After WhatsApp account creation,1040+ WhatsApp contacts of the Previous SIM User automatically synchronised with my google account .What a pathetic from Android,Google,WhatsApp developers?Now i should delete the previous users contact one by one.Further the sim contacts automatically synchronised to Non deletable View Only Contacts.The developers should disable auto synchronisation of Contact 2 prevent this kind of issue in future.",11/25/2025 12:09,0
9b6d21da-0042-4bf2-ba4e-b76c4fc78d87,5,whatsapp good bat net slow end call,11/21/2025 20:15,0
d8348aae-3050-4ed2-9b36-799e661865d3,4,It does what it's meant to do I guess. Meta AI sucks,11/22/2025 19:22,0
39ab0702-039e-422e-a99f-848eccead697,1,PLEASE!!!!!!! GIVE US FIETURE TAG EVERYONE!!!!!!! WE NEEEEEED THISSSSS!!!!!!!!,11/22/2025 19:19,1
74a13ca3-a660-46f9-afc0-cfec74c8a8a4,5,I want you to add a feature in contacts to hide someone's contact so my wife wouldn't know that who's number is this. She is very suspicious.,11/23/2025 7:16,0
ed597414-9127-48e9-9675-7a4b99a70450,5,It's a good app for people message from far away i love Whatsapp,11/26/2025 20:47,1
70a3ccc7-d841-47ee-b0a7-75fb2e72e28f,5,It's quite interesting but sometimes runs slow but I love it,11/22/2025 14:43,0
6948d9f5-2249-4104-a846-5f2b0159a0dc,4,this is my mostly used communication app and I love this app,11/23/2025 16:31,0
2a172bb5-a468-4731-a69d-b5ba1afc61d8,4,easy to use,11/22/2025 18:59,0
847d5ff9-d0a5-4213-aaa5-992cd1318ff9,1,"trying unmute most of contact and messages, but not responding. looks like no broker hacker is using my duplicate ph no and airtell no privacy and giving all access to hacker",11/26/2025 12:48,0
c5f60270-6940-497b-b82a-02c754cb6bc8,5,new cover WhatsApp maseenger,11/25/2025 2:56,0
83b76e54-fcac-4cfc-a605-5e31f1da16a2,4,send otp,11/22/2025 12:55,1
c4d35726-8513-44e0-99c9-bdb585314cdf,1,I can't understand this new feature ..can any one please understand me the same features,11/24/2025 22:18,0
3VDy6Igq-3Evo-zuub-BUhn-nURKTGuMnmqt,5,5EDeqSdCqcmKFz3ewUgZkUKWdc72plozQCTGVGO4mcz09EBSCR6og4Am0vyOsAlcudWgc6CIzX027Y66hc38lJ3lE,21/11/2025 23:28,1
4c03569d-75a7-4d7e-8f11-56ed86eb5617,1,This account can no longer use WhatsApp Business Recent activity on this account does not follow the WhatsApp Business Terms of Service on sending spam or other impermissible communications. This account's business info and chats are still on this device.,11/26/2025 14:52,0
0PMAd2u0-9B3V-iPLU-pbmA-KyF0pBVslRUw,1,5555555555555555555555555555555555555,26/11/2025 03:40,0
50a7bb72-d895-4ec1-bce1-f2dea083a5d5,2,"this WhatsApp it's very hassle, why because I'm log in today then tomorrow I can't open it because may account is spam why I hope fix it",11/25/2025 3:52,0
cb478367-c412-4742-a918-88815e4c718f,1,no quick respond from others,11/23/2025 19:44,0
91dfd4be-2e8e-4835-86a4-83ec0615e3a9,5,It is nice,11/26/2025 17:44,0
7f535311-15cf-45d6-91b3-c5b66cd58b2d,4,hello I've been recently having problem with gifs they won't load I searched in Google and it said to clear cache but will clearing cache loose all my messages?,11/25/2025 14:01,0
364683b4-f60a-45e0-ac98-d4a9238c7bd9,5,l need my what's app back,11/21/2025 23:45,0
UFHYJLaO-im4x-oK7g-FV36-fb3awtu7Y0lF,4,NX7NnGZDykMM2yrHaKoalnjOgY9UHjIsYeUeqZ5SLGk7IIN7ZTp8IybZod5m78Ngz0rI3Cw9JZZwTa,23/11/2025 09:12,0
c34f5efe-2c9c-4e9e-a5c9-002e401c784c,5,sir please unbanned my WhatsApp,11/25/2025 14:07,0
6c91df26-9813-49f8-ac8e-1ce29b1476d7,5,Bad ..... service in Pakistan Otherwise it will be finished.....,11/23/2025 6:59,1
92e3611b-3a06-447c-a679-6b389ba0b445,5,"nice and cool, very nice actually",11/23/2025 15:01,0
7d1fd285-25f7-4dc0-9326-def45d5ea9d3,5,"you need the official whatsapp to log in | you need the official whatsapp to log in problem Aapko WhatsApp login karte waqt error aa raha hai ""You need the official WhatsApp to log in"" ya phir ""This account can no longer use Wha...more",11/26/2025 21:23,0
730945b7-4ebb-4b15-a8b8-a702c7290101,1,what's app is not open,11/25/2025 22:44,0
jflOP4VB-SNnV-FiuG-Wraf-P0QQhtvnZ9d4,4,percentage percentage percentage percentage percentage percentage percentage percentage percentage percentage percentage percentage percentage percentage percentage percentage percentage percentage percentage percentage percentage percentage percentage percentage percentage percentage percentage percentage percentage percentage percentage percentage percentage percentage percentage percentage percentage percentage percentage percentage percentage percentage percentage percentage percentage percentage percentage percentage percentage percentage percentage percentage percentage percentage percentage percentage percentage percentage percentage percentage percentage percentage percentage percentage percentage percentage percentage percentage percentage percentage percentage percentage percentage percentage percentage percentage percentage percentage percentage ,25/11/2025 21:05,1
63a764df-7aa6-41fd-9be9-9a7c926c9d97,1,whatsapp is new sms service..it's pathetic to see unknown numbers sending whatsapp. moreover this latest update shows status horizontal and channels vertical scroll... might be good for increasing channel subscriptions..useless for individuals,11/26/2025 8:53,0
ce3e17c7-2628-4dcc-8f09-a8c934818428,5,is the best app,11/25/2025 10:04,0
c901cbfd-cedf-40d5-a96f-391c2fa9eb88,5,very nice 👍 good to use simple to learn,11/21/2025 22:14,0
d03a2e89-bdd3-4cc4-8296-2dd4ceeb628d,5,verification code is not received my mobile,11/24/2025 19:06,0
85b3d748-4846-4558-a1ac-389fb7cc38c4,1,"nothing better since my last update, every morning when I tried to check messages on my phone it's only Spammed messages I see.yet I didn't violet your terms of service what's wrong with this platform now it was reliable way to use for different purposes but now it's not work like that",11/24/2025 9:35,0
53f1056f-c549-4a0d-9772-c68be2d3205e,5,it messages easily to everyone and i like this app so much,11/24/2025 20:14,0
3fa89f1b-cd54-466a-9ca3-34cc0470b55d,1,it keeps sending me out and it's annoying plz stop it,11/24/2025 11:40,0
f6e9b928-a565-473a-ac8a-3b4c640b3913,5,"The problem I have here is I can't download profile pictures , the same way I can't take screenshots too",11/26/2025 10:54,0
3628c182-1044-41e6-8009-9aa97b7545c5,5,i need to asst about my whatsappa account,11/23/2025 17:09,0
c5cccd61-7ddd-499e-ad8c-add853c1c3ef,4,i star 4 because I want a little bit but very helpful change in WhatsApp pls add the option to cut part in video note and also increase the timeline of video note,11/23/2025 21:18,1
a61af695-594a-4dff-a98d-4c257a02b0f9,1,Not open whatsapp,11/25/2025 21:05,0
39c7815f-60b9-4480-a0fa-586e06ea30e8,4,It is normal,11/24/2025 16:43,0
4a438cfe-d5ac-4466-948a-9615c5b6f40a,1,I do not enjoy using this whatsapp because when I send people messages they do not go through,11/23/2025 20:21,0
Si1qkEPL-Yh91-6rtz-OpPb-QqBStCCw1THP,3,helpful joint strip funding demand split car adviser potential someone beside defendant oppose memory operate worth mind drive observer athletic mere put best silence top variety look facility slave follow obvious conventional research perceive farm Christmas strengthen used component carbon regime green funny regularly problem interpret equipment congressional money criticize prison direct pass itself corn level cooperation approximately severe dismiss green finish issue period supposed adviser fan,24/11/2025 13:42,1
6ee4fc8a-6f83-4e88-843f-04fa2381c444,5,It the best messaging app to ever exist,11/24/2025 14:32,0
a0f23158-adb3-4f2f-8cff-498110a83176,5,Rete this app,11/22/2025 5:12,0
84601cfd-6f9c-42df-acd7-1148d5ef305d,5,l recommend this app coz llike ut,11/25/2025 0:52,0
64f5c9f3-2a2a-4da9-9715-56e43b31cfa4,5,WhatsApp=100/100,11/24/2025 4:59,0
23cdf78e-9252-47d1-b804-ab3b945b272b,4,I will prefer this app it helps me a lot but I will love it more if it have streaks and some restores like tiktok snap chat and more I'm giving it five stores one it is like that please please respond..,11/22/2025 3:09,2
46f3b4a4-fd0a-423b-b001-5f5e86d064c1,1,open WhatsApp,11/26/2025 21:54,0
e7671aaa-e8bc-44e9-b900-07993e039e15,1,there is so many song are not added,11/22/2025 20:37,0
655acd1a-86b2-4f88-8628-3dc0fa2c972f,5,the app is a very nice app maybe you guy should add something like filter to the video and camera settings,11/24/2025 14:21,0
d75e13ca-32ef-4ecc-9d18-24a34bf39e09,5,I love chat,11/23/2025 13:20,0
d747d2c4-3e68-4dc7-83c2-3f3360d6f1e7,5,very informative,11/26/2025 9:33,0
933c7ae5-4c8d-4c93-9de0-d5d906138e4e,5,I enjoy the App,11/26/2025 16:44,0
fab2b8e6-b00f-4fd8-ae56-433ca617db6c,3,My whatsapp is always blocked almost every other day for verifying and I don't know how it happens and what are they verifying?,11/22/2025 1:53,0
QAZ9ymOZ-1RYj-h6qZ-0LxM-OWUDPnJyDGsD,1,expansion expansion expansion expansion expansion expansion expansion expansion expansion expansion expansion expansion expansion expansion expansion expansion expansion expansion expansion expansion expansion expansion expansion expansion expansion expansion expansion expansion expansion expansion expansion expansion expansion expansion expansion expansion expansion expansion expansion expansion expansion expansion expansion expansion expansion expansion expansion expansion expansion expansion expansion expansion expansion expansion expansion expansion expansion expansion expansion expansion expansion expansion expansion expansion expansion expansion expansion expansion expansion expansion expansion expansion expansion expansion expansion expansion expansion expansion expansion expansion expansion expansion expansion expansion expansion ,24/11/2025 03:02,1
5b89f90e-1b27-4023-90aa-0cda1567492d,4,Being in a LDR marriage can be tough at times. Communication is a big part of the reason my marriage works. WhatsApp has been my husband's and I main form of communication since we were in the courting/dating stage of our relationship. It's reliable for the most part and we have had minimal issues. Definitely would recommend for those who wish to keep in touch with love ones who are overseas.,11/22/2025 21:34,3
d164cd58-2f99-4c55-a675-dc685d1cd51c,5,The used of WhatsApp brings a lot of many questions about the same thing as a good time for me and my friend 💞,11/26/2025 0:45,0
8dbbba29-fdd5-4c48-80cf-32103b29dcda,5,This app is soo cool,11/22/2025 14:08,0
2d4e3b8f-ab09-4710-922f-cdf8ebaeb410,4,Pls i want chat with my watsapp but he s not working,11/26/2025 14:11,1
3e0f64a6-15ff-491f-ab52-05fbd3bdf624,2,slow updating,11/26/2025 21:55,0
1f07142b-813d-4d58-b0e4-3d98e460c65b,5,I have really helped a lot of people there who had the same interest as meq,11/24/2025 20:15,0
836d2583-5298-4461-8ab6-7a08690821dc,5,very good app,11/23/2025 0:24,0
ed68e1a3-96d9-4e90-9ecc-7d84f7c66bfa,1,the backup restore is random,11/23/2025 21:34,0
d6e68f8c-adc6-4fdd-b33b-ab05f413fa53,1,my WhatsApp massager is stopping,11/23/2025 22:54,0
b634e5a6-6dc7-4866-b6c3-b6521c7bb218,1,"The problem is that the word ""bio"" has a limited duration and then disappears. This is a very bad problem; please fix it.",11/23/2025 13:07,0
139f933c-d267-47d0-950c-60cfbb9a8cba,5,very useful,11/21/2025 21:17,0
7a4ae2f4-6fbb-4fc2-9010-78c239af7582,1,chatlock option is worthless it doesn't give any backup and only option ia unlock and clear chat I hate this option,11/23/2025 20:45,0
129c7a0d-da85-4542-b666-496e552afaaa,1,I what my messages back on WhatsApp please because I don't know how retrieve my messages how do I report threatend message on WhatsApp and I can't see about,11/23/2025 23:49,2
4e4b53a7-8d20-4042-ac8d-835c1b880ea3,1,My WhatsApp nomber don't want work My WhatsApp number is not working,11/26/2025 2:33,1
827770d3-13f7-4894-92db-b57d6b6b821b,5,Very easy,11/25/2025 12:30,0
bfbd98fb-627c-4aab-9383-6a4093e52911,1,"I love Whatsapp because It's very good to us we can use it to chat, get information, and to communicate",11/26/2025 13:29,0
9fb34058-3cb9-4c15-8a26-38882c2d6c00,5,best app I really like using it,11/24/2025 14:46,0
c717d400-bc41-4563-bd99-a4bb5851f30f,5,I enjoy using WhatsApp messager but I have small issues why my WhatsApp always lock please check my WhatsApp,11/26/2025 1:15,0
a7e146b6-72f4-4e95-8216-0bafd05b4375,3,Good apps,11/22/2025 23:46,0
b09ac218-7bd8-4859-9dea-9ad7589ff036,5,great good luck,11/26/2025 12:36,0
c48b9a8c-db44-431a-8c3d-88a87a8eff40,5,it's nice,11/24/2025 8:52,0
ccd6807a-928d-45bf-8888-54ad4fd5de16,5,very interesting,11/24/2025 14:38,0
8f730d53-3b9f-447a-9adf-b32539dcf18a,4,my experience is very good,11/24/2025 6:40,0
521a757c-f089-480b-a9cd-db29eeb35a68,1,My whatsapp do not opening,11/26/2025 20:57,0
a0f7f3b8-b082-4784-9eec-b9055e0ab2c8,5,very nice app and easy to use,11/25/2025 9:21,0
bd4d742f-68b9-4389-ae0d-9045654009b6,5,It is good,11/24/2025 17:59,1
eXoJmhSu-LwAs-3N0U-9ANc-Zu9tiiw3MGyQ,3,qqqqqqqqqqqqqqqqqqqqqqqqqqqqqqqqqqqqqqqqqqqq,22/11/2025 12:24,0
2280bfd8-8655-4763-9d8a-059db4693cf3,5,This app is nice,11/22/2025 18:47,0
e300fb25-64e5-47b6-8170-c8277841ca36,2,"you experience lots of hitched with your app .. instead of increasing featured, try working on the lapses .. I'm tired abeg",11/26/2025 3:31,0
4gzlD1Yx-IlRY-XT1N-zeF1-L1infJDuca4O,3,iiiiiiiiiiiiiiiiiiiiiiiiiiiiiiiiiiiiiiiiiiiiiiiiiiiiiiiiii,24/11/2025 08:03,0
UlyAlo1d-AoNE-6jCF-EOKy-bnRuKgPZjBCQ,4,sample sample sample sample sample sample sample sample sample sample sample sample sample sample sample sample sample sample sample sample sample sample sample sample sample sample sample sample sample sample sample sample sample sample sample sample sample sample sample sample sample sample sample sample sample sample sample sample sample sample sample sample sample sample sample sample sample sample sample sample sample sample sample sample sample sample sample sample sample sample sample sample sample sample sample sample sample ,21/11/2025 02:02,1
f1ea8193-fe6c-4417-883b-f4b3906b4633,2,Awesome thanks,11/25/2025 19:56,0
a7bad3b5-3210-4f0b-a2f5-fefe5447be4d,4,GBox is a very good app but only one problem they do not support whatsapp,11/24/2025 13:47,0
HmvA0PDs-VoE6-gPQG-X8Ta-AdrqZAWVEiaD,1,3XxinZKBCmuwNNlpPA31h1dsoIfUFHjIZIZjOtxgG2GByXelgMlUKSSWMVTtkGiZUW0Q5opcEVvfGUj,26/11/2025 21:09,0
6a2ffe1c-68eb-4770-9a95-3910510a8314,1,Edit: Personalized Read Receipts? only then blue ticks on for a few chats and not for everyone. that will be such a handy feature to have. 1 starring tk change from 5 so it comes up as a new comment ---- Is it possible to add an authentication password so that i can log out without unlinking it & next time I use it I just have to type in my password without looking for my cell & pick where I left.,11/24/2025 16:00,12
fca917d4-7c4b-4aed-a4e4-6d578a9e2ef7,5,"convenient, fast and easy in business, and also personal usage.",11/25/2025 5:54,0
eb1c046e-fa7d-4c19-9779-6a9e2d96c4ad,1,i have a problem with login to another new phone,11/25/2025 7:32,0
0e374106-5faa-4b51-9980-7a7e2ffddd0c,5,My whatsapp is not updating,11/26/2025 18:26,0
23b52884-9ac2-484a-9519-2749924ffd83,1,unable to lock chats.. again and again showing set up device passcode.. even after setting up a password it is still the same.. worst really worst,11/22/2025 15:32,0
4ec78f58-d1f9-4fa3-9a25-d3024f17435b,5,the best communications app.,11/25/2025 11:12,0
5c517624-18a9-45c9-8239-21fdbf422dcb,3,Okkk good 👍👍👍 👍👍👍 nice 👍👍👍👍 simple and describe the wjhccv,11/26/2025 18:17,0
5920c5f4-7518-4d8b-8a25-f2963da46158,4,there should be a send schedule,11/25/2025 23:22,0
ece0b270-3318-42ff-8347-6eb653e7cd9b,1,Help my Whattsapp number is banned I am facing a problm whattsapp this account is not allowed to use whattsapp Due to spam please fix this problm and return to review my whattsapp number I have not did anything against Whatsapp policy and rule's I am sure that my number has been banned by mistake please review my request My whattsapp number Thanks and regards,11/26/2025 18:37,0
c5639543-425c-422b-9ab8-970e3b3023a3,1,"Why I can't pin the massage l, Please fix it",11/26/2025 12:41,0
68a2f163-0191-4aa3-8bd9-991d970778e2,5,please open,11/25/2025 6:44,0
0964d64f-c097-46d6-a95f-44bfeeb96446,5,easy to reach,11/24/2025 18:19,0
1cde8ed2-bc74-4aaf-b5f5-d6af9dd2dd69,5,"It's fantastic, it's the app I use the most.🥰🌹🤍",11/26/2025 18:36,0
4b4314b2-a903-4a0e-bd39-31218641e341,5,good for use,11/22/2025 18:31,0
4acc6951-386f-4382-a49d-9d99ad6a19df,5,thanks for your help,11/24/2025 20:56,0
68ed7d4b-52f8-4efa-81fa-3ceb60127d8f,1,"I absolutely hate how whatsapp is forcing me to update the app when it's completely fine as it is.It won't let me access the app,i can't receive messages nor send them because i have to get gain space inorder to download (update) for te new whatsapp.",11/25/2025 18:57,0
dee65eb7-a0aa-4708-9567-03897a8ef29e,1,"why the ""About"" status has only 50 characters now? And why on earth does it have a timer now??? I don't understand why developers want WhatsApp to be like other social media platforms???!!!!!",11/25/2025 16:09,0
ad8b784c-e8c5-4644-9f27-d85a94ced434,5,good experiences with WhatsApp,11/22/2025 17:55,0
M3DrHDDW-iQof-Iq4K-RClw-R5K66195aqHN,3,GGGGGGGGGGGGGGGGGGGGGGGGGGGGGGGGGGGGGGGGGGGGGGGGGGGGGGGGGGGGGGGGGGGGGGGGGGGGGGGGGGGGGG,23/11/2025 07:35,0
7a175559-9def-4046-8cb9-1a45ba05d6c1,1,there is an issue of the keyboard in only WhatsApp,11/23/2025 8:33,0
608365f4-af4d-41c6-9384-2419e9664f8b,4,I think you should remove the 'channel' option from whatsapp it's not important. make whatsapp simple messenger application.,11/23/2025 21:12,2
e1127fb5-634c-4110-8776-d0def747f3db,5,best application,11/22/2025 22:56,0
0f58a782-86d8-4760-819d-394053b1d661,5,best app for remaining in touch with friends and loved ones. broadcast MSG limit is very less. it can be 500 p.m.,11/24/2025 10:56,0
d19b591c-f4ea-4a56-8f38-2fc74311af15,2,"i have 2 WhatsApp number running in 1 app. the other number never get any notification, I must switch accounts regularly. why create a feature for running 2 numbers at the same time, but you must switch regularly? what concept is that?",11/23/2025 18:38,0
bd7e70ab-afbb-4a50-8e47-dce46801faed,1,it suddenly stopped working. I open the app and it closes immediately,11/23/2025 17:25,0
89539246-9b2f-43de-a281-8d62c8f52f5e,1,very bad app my watsapp account banned since 10 days poor app bad poor,11/24/2025 19:38,0
IYih9NAc-Py3y-uGDi-EdDm-0zWCqmLc0wLa,2,6666666666666666666666666666666666666666666666666,26/11/2025 09:32,0
0a04fb01-e38f-4af4-95f7-c6fdbe147803,5,WhatsApp is a good app in my opinion,11/23/2025 12:39,0
5284a5fa-39ea-40d9-9de7-034c406782a4,5,this app are usefull,11/22/2025 18:49,0
02c091fe-dd40-4b4e-b4d6-b47489a25d86,4,thank you,11/25/2025 20:05,0
588a2e0f-cb23-4c86-bc59-aac8cca3e772,5,It's very very Good,11/26/2025 16:33,0
01b5435d-afa1-48ff-9c9f-ec7d1d9f1985,4,can u add themes option for home screen of WhatsApp. it would be very helpful and make the app look more interesting.,11/23/2025 17:29,0
50d2aec6-d659-4397-bfac-cf3e9032c39e,5,This application is good to connect with each other,11/22/2025 21:29,0
5bfe3fd0-ee62-456a-a872-69105eddc9f0,5,its a perfect application But please just don't ruined it like facebook it was fun once but now look at the face book please keep it like this and don't rush like adding thi feature and this and this if you want those feature made a new app adding more & more features will ruined the fun and main motive of this app adding channels was enough thats a good thing but don't make ir overloaded with unnecessary features thats just an advice from a programmer guys you are the the best of world anyway,11/22/2025 5:23,0
bd839587-ff07-413f-a137-04fafd3481e8,5,Nice thanks My watsapp,11/22/2025 21:13,0
